"Author","BHL CreatorID","VIAF ID","Associated Title","DOI"
"Goebel, K.","1338","59878972","Organographie der Pflanzen, insbesondere der Archegoniaten und Samenpflanzen /  von K. Goebel.","10.5962/bhl.title.31994"
"Showers, H. D. W.","25246","","Rev. Aura Claire Showers : a sketch of his life / by his wife ; together with tributes by ministerial brethren ; to which is added a treatise on the doctrine of eternal punishment and other unpublished manuscripts.","10.5962/bhl.title.32004"
"Jones, Marcus Eugene,","25259","45993901","Revision of North-American species of Astragalus,  by Marcus E. Jones.","10.5962/bhl.title.32021"
"Adams, John Quincy, ","16279","36980021","The duplicate letters, the fisheries and the Mississippi. Documents relating to transactions at the negotiation of Ghent. Collected and pub. by John Quincy Adams, one of the commissioners of the United States at that negotiation.","10.5962/bhl.title.32219"
"Scott, Dukinfield Henry,","1712","59201263","An introduction to structural botany...  By Dukinfield Henry Scott...","10.5962/bhl.title.32237"
"Guttenberg, Adolf, Ritter von,","23968","8199775","Die Wachsthumsgesetze des Waldes. Vortrag gehalten im Wissenschaftlichen Club zu Wien am 16. April 1885. ","10.5962/bhl.title.32243"
"Willoughby de Broke, Richard Greville Verney,","24263","59973395","The sport of our ancestors : being a collection of prose and verse setting forth the sport of fox-hunting / edited and selected with an introduction and appreciations by Lord Willoughby de Broke ; illustrated by G.D. Armour.","10.5962/bhl.title.32272"
"Cory, Charles B.","1171","88752385","Notes on little known species of South American birds with descriptions of new subspecies,  by Charles B. Cory.","10.5962/bhl.title.3235"
"Hayes, M. Horace","7654","48005318","Veterinary notes for horse owners : a manual of horse medicine and surgery / by M. Horace Hayes.","10.5962/bhl.title.32509"
"Ryding, William.","25497","161783653","Veterinary pathology ; or, A treatise on the cause and progress of the diseases of the horse : together with the most approved methods of prevention and cure. To which are added short observations of bleeding, firing, roweling, fomentations, and poultices, and an appendix; or, veterinary dispensatory, containing the most approved prescriptions for the different diseases of the horse /","10.5962/bhl.title.32510"
"Smith, Robert Angus,","25637","49340614","A centenary of science in Manchester (in a series of notes)  By R. Angus Smith ...","10.5962/bhl.title.32771"
"Suzuki, Shinkichi K.","25646","","On the growth of the rice plant,  by Shinkichi Suzuki.","10.5962/bhl.title.32785"
"Barrell, Joseph,","1762","69294718","Central Connecticut in the geologic past,  by Joseph Barrell ...","10.5962/bhl.title.32990"
"Atkinson, George Francis,","1902","33506279","A college text-book of Botany, being an enlargement of the author's ""Elementary Botany."" ","10.5962/bhl.title.33027"
"Richardson, Eugene Stanley,","2609","18469117","Pennsylvanian invertebrates of the Mazon Creek area, Illinois. Trilobitomorpha, Arthropleurida / Eugene S. Richardson, Jr., Curator of Fossil Invertebrates.","10.5962/bhl.title.3306"
"Cook, John,","25803","","Observations on fox-hunting /  by Colonel Cook.","10.5962/bhl.title.33080"
"Goltz, Theodor von der,","20344","72195968","Vorlesungen über Agrarwesen und Agrarpolitik.","10.5962/bhl.title.33102"
"McClure, Robert.","18240","","The gentleman's stable guide : containing a familiar description of the American stable; the most approved method of feeding, grooming and general management of horses; together with directions for the care of carriages, harness, etc. /","10.5962/bhl.title.33261"
"Wheelwright, Horace William,","22474","40319519","Bush wanderings of a naturalist : or, notes on the field sports and fauna of Australia Felix / by an old bushman.","10.5962/bhl.title.33268"
"Scharff, Robert Francis,","23693","13076267","The history of the European fauna.  ","10.5962/bhl.title.33300"
"Villiers-Stuart, C. M.","26003","25928190","Gardens of the great Mughals,  by C.M. Villiers Stuart.","10.5962/bhl.title.33481"
"Mulertt, Hugo.","7305","36551258","The goldfish and its systematic culture with a view to profit. A practical treatise on the fish, its propagation, enemies, diseases, and care of the fish in captivity, together with hints on the construction of ponds, etc. Illustrated with colored frontispiece and nineteen wood-cuts, drawn from nature.","10.5962/bhl.title.33586"
"Hieover, Harry,","13687","43920125","Stable talk and table talk : or, Spectacles for young sportsmen / By Harry Hieover [pseud.] ...","10.5962/bhl.title.33596"
"Redfield, Casper Lavater,","1112","53988845","Human heredity,  by Casper L. Redfield.","10.5962/bhl.title.33667"
"Allen, William Fitch,","10244","65469330","Distribution of the subcutaneous vessels in the head region of the ganoids, Polyodon and Lepisosteus.  ","10.5962/bhl.title.33737"
"Huxley, Thomas Henry,","1216","66511085","On our knowledge of the causes of the phenomena of organic nature. Being six lectures to working men, delivered at the Museum of practical geology. ","10.5962/bhl.title.33754"
"Robinson, John H.","26537","","Common-sense poultry doctor.  By John H. Robinson ...","10.5962/bhl.title.34199"
"Hershkovitz, Philip.","2686","27871506","On the nomenclature of certain whales.","10.5962/bhl.title.3427"
"Bodemeyer, Hauptmann E. von.","26591","","Quer durch Klein-Asien in den Bulghar-Dagh : Eine naturwissenschaftliche Studien-Reise / Hauptmann E. v. Bodemeyer.","10.5962/bhl.title.34272"
"Hoveland, Carl Soren,","26736","113308886","Defoliation of oats and pearlmillet as related to herbage yield /  by Carl Soren Hoveland.","10.5962/bhl.title.34479"
"United States. Bureau of fisheries","26285","127824913","Fiscal regulations governing employments in the field,  ","10.5962/bhl.title.34564"
"Down, Clinton A.,","26972","","Liberty manual of chickens.  ","10.5962/bhl.title.34737"
"Huxley, Thomas Henry,","1216","66511085","Introductory /  By Professor Huxley, F. R. S.","10.5962/bhl.title.34830"
"Dufour, Léon,","2970","61554496","Recherches anatomiques et physiologiques sur les hémiptères : accompagnées de considérations relatives a l'histoire naturelle et a la classification des ces insectes / par Léon Dufour.","10.5962/bhl.title.34925"
"Dilly, Antoine.","27088","71401204","Traité de l'ame et de la connoissance des bêtes : ou apres avoir demontre la spiritualité de l'ame de l'homme l'on explíque par la seule machine, les actions les plus surprenantes des animaux, suivant les principes de Descartes / par A. D. ...","10.5962/bhl.title.34929"
"Pearce, Joseph Abner.","26462","","The Pearce new method of bee keeping,  by Joseph A. Pearce ...","10.5962/bhl.title.34965"
"Northrup, King & co., Minneapolis.","27139","","Onion culture; planting, cultivating, harvesting and marketing ...  ","10.5962/bhl.title.34985"
"Jesien, W. S.","27185","166028371","Secondary agricultural schools in Russia /  by W. S. Jesien.","10.5962/bhl.title.35049"
"Roe, Edward Payson,","18462","27426165","Success with small fruits /  by Edward P. Roe ... with illustrations.","10.5962/bhl.title.35354"
"Blew, William Charles Arlington,","23572","43866182","Light horses : breeds and management / by W.C.A. Blew ... [et al.].","10.5962/bhl.title.35386"
"Phillips, Everett Franklin,","9368","234622159","The rearing of queen bees /","10.5962/bhl.title.109857"
"Narsh, J. M.","27541","","The Narsh poultry system,  ","10.5962/bhl.title.35460"
"Traylor, Melvin A.","2754","110054552","New birds from Peru and Ecuador  [by] Melvin A. Traylor.","10.5962/bhl.title.3557"
"Murray, John Alan,","27630","28710431","The estimation of condition in cattle,  ","10.5962/bhl.title.35579"
"Massachusetts.","26229","","Massachusetts creamery interests.  ","10.5962/bhl.title.35697"
"Bailey, L. H.","1947","71646721","The holy earth,  ","10.5962/bhl.title.35710"
"Parker, George Howard,","1608","121651195","Effects of expolosive sounds, such as those produced by motor boats and guns, upon fishes ","10.5962/bhl.title.35782"
"Norman, Alfred Merle,","2043","19663376","British Amphipoda of the tribe Hyperiidea and the families Orchestiidae and some Lysianassidae / by [A.M.] Norman. ","10.5962/bhl.title.35832"
"Fernow, Bernhard Eduard,","28015","3273617","Forest policies and forest management in Germany and British India.  By B. E. Fernow.","10.5962/bhl.title.36130"
"United States.","26306","139556161","Rules and regulations governing forest reserves established under section 24 of the act of March 3, 1891 (26 Stats., 1095.)  ","10.5962/bhl.title.36169"
"Barnes, Thomas C.","28066","101528787","Laboratory manual of general physiology /  by T. Cunliffe Barnes.","10.5962/bhl.title.36198"
"Seal, William P.","28099","","Fishes in their relation to the mosquito problem.  ","10.5962/bhl.title.36233"
"Hile, John W.","28338","","Plans for constructing the improved Hammonton incubators, also information on incubation and appliances.   ","10.5962/bhl.title.36581"
"Buffon, Georges Louis Leclerc,","2134","36915547","Natural history of birds, fish, insects, and reptiles,  embellished with upwards of two hundred engravings.","10.5962/bhl.title.36896"
"Hesler, L. R.","15698","37312993","Black rot, leaf spot and canker of pomaceous fruits /  L.R. Hesler.","10.5962/bhl.title.36922"
"Allen, Clifford P.","28747","2046296","Log of the tenth annual cruise of the Second Presbyterian fishing club of Philadelphia, July 3d to 14th, 1880,  ","10.5962/bhl.title.37100"
"Bolles, Charlton Burgess.","28699","","Propagation of the dahlia,  by Charlton Burgess Bolles.","10.5962/bhl.title.37175"
"Druery, Chas. T.","29116","14678228","British ferns and their varieties /  by Charles T. Druery. Illustrated with 40 coloured plates, 96 nature prints, and 319 wood cuts and other illustrations.","10.5962/bhl.title.37726"
"Hill, John,","3421","","The construction of timber from its early growth; explained by the microscope, and proved from experiments, in a great variety of kinds: in five books, on the parts of trees; wtheir vessels; and their encrease by growth, and on the different dispositionof thefe parts in various kinds; and the particularities in their vessels, with figures of their various appearances, of the instrument for cutting the; and of the microscope thro' which they were viewed /","10.5962/bhl.title.37736"
"Inger, Robert F.","2612","10820227","Three new skinks related to Sphenomorphus variegatus (Peters)","10.5962/bhl.title.3795"
"Ross, Alexander Milton,","12031","293434198","The birds of Canada with descriptions of their habits, food, nests, eggs, times of arrival and departure / by Alexander Milton Ross.","10.5962/bhl.title.38298"
"Moore, Henry F.","26482","58937214","Canadian lands and their development  by Henry F. Moore.","10.5962/bhl.title.38470"
"Chamberlain, Montague,","6789","48802496","A catalogue of Canadian birds with notes on the distribution of the species / by Montague Chamberlain.","10.5962/bhl.title.38680"
"Jordan, William Leighton.","20461","48377887","The ocean : a treatise on ocean currents and tides and their causes, demonstrating the system of the world / William Leighton Jordan.","10.5962/bhl.title.38690"
"Research Analysis Group.","29678","","Physics of sound in the sea.  ","10.5962/bhl.title.38776"
"Craig, John,","21124","","Fruit growing in Canada  by John Craig.","10.5962/bhl.title.38781"
"James, C. C.","17489","","Agriculture  Charles C. James.","10.5962/bhl.title.38832"
"Crdenas, Juan de,","21288","","Primera parte de los problemas y secretos marauillosos de las Indias; compuesta por Iuan de Cardenas.  En Mxico, En casa de Pedro Ocharte, ao de 1591. ","10.5962/bhl.title.39143"
"Elliot, Daniel Giraud,","1624","18001598","Description of apparently new species and sub-species of mammals from the Indian Territory /  by D.G. Elliot.","10.5962/bhl.title.39799"
"Marivault,   de","30567","54077705","De la situation agricole de la France, et des moyens de l'amliorer. ","10.5962/bhl.title.40036"
"Morin, Pierre,","30584","100274923","Remarqves necessaires pour la culture des flevrs. La maniere avec laquelle il les faut cultiver, & les ouvrages qu'il faut faire selon chaque mois de l'anne.  Avec une methode facile pour faire toutes sortes de palissades, bosquets, & autres ornemens qui servent ⏟⏟ l'embellissement des jardins de plaisir; & un catalogue des plantes les plus rares: le tout diligemment observ","10.5962/bhl.title.40057"
"Irmler, Ulrich.","3611","35005240","New species of the genera Lispinus and Neolosus (Staphylinidae: Osoriinae) from the Neotropics /  by Ulrich Irmler.","10.5962/bhl.title.4049"
"Phillis, William Avery,","30925","","Microanatomical study on the eyes of the lone star tick and the screwworm fly with related electrophysiological studies /  by William Avery Phillis III.","10.5962/bhl.title.40542"
"Overton, Frank,","14650","74050739","Applied physiology : including the effects of alcohol and narcotics / by Frank Overton ; advanced grade.","10.5962/bhl.title.40767"
"Holder, Charles Frederick,","7301","1514024","The fishes of the Pacific coast;  ","10.5962/bhl.title.40995"
"Henderson, Alfred.","28803","45952250","Peter Henderson, gardener, author, merchant : a memoir / by Alfred Henderson.","10.5962/bhl.title.41236"
"Harper, R. B.","31377","","The art of planting, growing, curing and handling fine tobacco,  ","10.5962/bhl.title.41268"
"Schillings, Carl George,","31438","","Mit Blitzlicht und Büchse : neue Beobachtungen und Erlebnisse in der Wildnis inmitten der Tierwelt von Äquatorial-Ostafrika / von C.G. Schillings.","10.5962/bhl.title.41412"
"United States. Bureau of Ethnology","31445","159021806","Dictionary of American Indians north of Mexico.  ","10.5962/bhl.title.41428"
"Grove, H. D.","31506","","An essay on sheep.   ","10.5962/bhl.title.41587"
"Harrison, C[harles] S[immons],","31711","31724937","The gold mine in the front yard and how to work it,   ","10.5962/bhl.title.41894"
"Pontey, William.","17703","29925294","The profitable planter : a treatise on the theory and practice of planting forest trees, in every description of soil and situation; more particularly on elevated sites, barren heaths, rocky soils, &c., including directions for the planting and management of permanent screens; with useful hints on shelter and ornament /","10.5962/bhl.title.42696"
"Cressy, Noah.","22339","14684235","An address on the natural history and pathological osteology of the horse,","10.5962/bhl.title.42723"
"Nguyen, Khuong Ba,","32401","31916484","A new nematode parasite of mole crickets : its taxonomy, biology and potential for biological control / by Khuong Ba Nguyen.","10.5962/bhl.title.42754"
"Whitten, John Charles,","32491","36718210","Hints on pruning;   ","10.5962/bhl.title.42890"
"Lochman, Charles L.","3883","","Photographs of medicinal and economic plants from natural specimens: plates, figures /by Charles L. Lochman.","10.5962/bhl.title.4300"
"Westgate, John Minton","32662","123932991","Alfalfa growing for seed and hay.   ","10.5962/bhl.title.43115"
"Cutting, Hiram Adolphus,","32697","48442963","An address upon farm pests, including insects, Fungi, and animalcules,  ","10.5962/bhl.title.43160"
"Patton, Charles U.","32700","","The common-sense horse book,   ","10.5962/bhl.title.43164"
"Bailey, John M.","32717","50910456","The book of ensilage; or, The new dispensation for farmers.  Experience with ""ensilage"" at ""Winning farm.""  How to produce milk for one cent per quart; butter for ten cents per pound; beef for four cents per pound; mutton for nothing if wool is thirty cents per pound.","10.5962/bhl.title.43222"
"Ardrey, Robert L.","32804","44487832","American agricultural implements; a review of invention and development in the agricultural implement industry of the United States ... By R. L. Ardrey.","10.5962/bhl.title.43290"
"Societa agraria di Lombardia.","32622","","Statuto organico ...  ","10.5962/bhl.title.43670"
"California. Fruit growers' convention. 5th, Los Angeles, 1885","32953","128458382","California fruit culture.  ","10.5962/bhl.title.43693"
"Balkwill, Francis Hancock.","33327","","The testimony of the teeth to man's place in nature, with other essays on the doctrine of evolution, by F. H. Balkwill.","10.5962/bhl.title.43970"
"LeConte, Joseph,","1683","29769631","Outlines of the comparative physiology and morphology of animals,  by Joseph Le Conte.","10.5962/bhl.title.44007"
"Bailey, Frederick R.","19015","6314450","A text-book of histology /  by Frederick R. Bailey.","10.5962/bhl.title.44102"
"Heitzmann, Carl,","22316","54137480","Microscopical morphology of the animal body in health and disease,  by C. Heitzmann. With 380 original engravings.","10.5962/bhl.title.44154"
"Hawk, Philip B.","15437","33638848","Practical physiological chemistry : a book designed for use in courses in practical physiological chemistry in schools of medicine and of science / by Philip B. Hawk.","10.5962/bhl.title.44157"
"Simon, Charles E.","17864","","A text-book of physiological chemistry for students of medicine and physicians.  By Charles E. Simon.","10.5962/bhl.title.44236"
"Gould, Harris Perley,","28794","118188782","Peach-growing,  by H. P. Gould.","10.5962/bhl.title.44307"
"Jaques, R. M.","33567","","The Easby Abbey breeding stud : ","10.5962/bhl.title.44437"
"Keith, Arthur,","1547","46753857","Human embryology and morphology;  by Arthur Keith ...","10.5962/bhl.title.44611"
"Roberts, Harry,","14867","","The book of old-fashioned flowers and other plants which thrive in the open-air of England,","10.5962/bhl.title.84829"
"Abel, John Jacob,","4119","4922239","John Jacob Abel, M.D. : investigator, teacher, prophet, 1857-1938 ; a collection of papers by and about the father of American pharmacology.","10.5962/bhl.title.4544"
"Anderson, Edgar,","4127","6440526","Introgressive hybridization.  ","10.5962/bhl.title.4553"
"Wardle, Thomas,","27705","14339783","On the entomology and uses of silk : with a list of the families, genera, and species of silk producers known up to the present date. ","10.5962/bhl.title.45543"
"Smuts, Jan Christiaan,","4139","59144119","Holism and evolution,  by General the Right Honorable J. C. Smuts.","10.5962/bhl.title.4568"
"Owen, Richard,","1203","64089233","Memoir on the megatherium, or giant ground-sloth of America.  ","10.5962/bhl.title.45767"
"Jack, Edward","34253","","Intercolonial Railway tributary forests -report  Edward Jack.","10.5962/bhl.title.45819"
"Piera y Siles, Bartolom,","34486","","Descripcion histórica de una nueva especie de corea, ó baile de San Vito : originada de la picadura de un insecto, que por los fenómenos seguidos á ella se ha creido ser la tarántula ... / por el Doctor Don Bartolomé Piñera y Siles.","10.5962/bhl.title.46160"
"Ognev, S. I.","34575","84824072","Mammals of Eastern Europe and Northern Asia.  ","10.5962/bhl.title.46316"
"Bose, Jagadis Chandra,","4211","30320858","The physiology of photosynthesis,  by Sir Jagadis Chunder Bose; with sixty illustrations.","10.5962/bhl.title.4668"
"Reichenbach, H. G. Ludwig","364","3198169","Iconographia botanica exotica, sive Hortus botanicus ...  ","10.5962/bhl.title.46725"
"Semper, C.","9819","29594521","Landmollusken /  C. Semper.","10.5962/bhl.title.46996"
"Fries, Elias Magnus,","4771","66568799","Eliae Fries Summa vegetabilium Scandinaviae, seu Enumeratio systematica et critica plantarum quum cotyledonearum, tum nemearum inter Mare Occidentale et Album, inter Eidoram et Nordkap, hactenus lectarum, indicata simul distributione geographica ... Accedunt expositio systematis plantarrum morphologici, comparatio vegetationis adjacentium regionum, definitiones specierum in Kochii Synopsi florae germanicae et nemearum monographiis haud obviarum L. aliter expositarum. ","10.5962/bhl.title.47008"
"Krauss, Wolfgang,","35522","","Interaction between surface and internal waves in shallow water  [by] W. Krauss..","10.5962/bhl.title.47680"
"Loeb, Leo,","4403","42621111","The biological basis of individuality,  by Leo Loeb.","10.5962/bhl.title.4835"
"Schreuder, Pieter Juriaan van der Heyde,","35959","","The Cape horse : its origin, breeding and development in the union of South Africa / by Pieter Juriaan van der Heyde Schreuder.","10.5962/bhl.title.48666"
"Shaw, Thomas,","12831","","Weeds and how to eradicate them, ","10.5962/bhl.title.48725"
"Schellenberg, Johann Rudolf,","8884","24870562","Genres des mouches diptères représentés en XLII. planches projettées et dessinées","10.5962/bhl.title.48777"
"Harry, William Cleaver,","36111","119335011","The manual of floral designing, ","10.5962/bhl.title.48921"
"Berkenhout, John,","36160","39601554","Clavis Anglíca linguæ botanicæ : or, a Botanical Lexicon in which the terms of botany, particularly those occurring in the works of Linnaeus, and other writers, areapplied, derived, explained, contrasted, and exemplified","10.5962/bhl.title.48979"
"Cobb, John N.","21850","107536433","Pacific salmon fisheries. ","10.5962/bhl.title.49660"
"Prime, William Cowper,","25044","34816237","I go a-fishing, ","10.5962/bhl.title.49816"
"Lyell, Charles.","36886","68999334","Supplement to the fifth edition of A manual of elementary geology.","10.5962/bhl.title.50022"
"Günther, Albert C. L. G. (Albert Carl Ludwig Gotthilf)","7183","5048452","The reptiles of British India / by Albert C. L. G. G⏟_nther.","10.5962/bhl.title.5012"
"Cocteau, J. T.","4557","68919395","Études sur les Scincoïdes / par J.T. Cocteau.","10.5962/bhl.title.5013"
"Poppius, Alfred.","37085","19830010","Finlands dendrometridae /","10.5962/bhl.title.50301"
"Ross, Herbert Holdsworth,","4088","71465769","A generic classification of the Nearctic sawflies (Hymenoptera, Symphyta)","10.5962/bhl.title.50339"
"Spooner, Charles Stockman,","37116","290619890","The phylogeny of the Hemiptera based on a study of the head capsule. ","10.5962/bhl.title.50343"
"Heude, Pierre Marie,","13343","230128237","Notes sur les mollusques terrestres de la Valle⏟e du Fleuve Bleu. ","10.5962/bhl.title.50365"
"Pampanini, R.","9178","89343886","Astragalus alopecuroides Linneo : (em. Pampanini) /","10.5962/bhl.title.50456"
"Le Moine, J. M.","12038","25463834","Les p_cheries du Canada / ","10.5962/bhl.title.50601"
"Springer, John S","18382","73456880","Forest life and forest trees comprising winter camp-life among the loggers, and wild-wood adventure : with descriptions of lumbering operations on the various rivers of Maine and New Brunswick /","10.5962/bhl.title.50842"
"Laurenti, Joseph Nicolas,","38332","100199803","Josephi Nicolai Laurenti ... Specimen medicum : exhibens synopsin reptilium emendatam cum experimentis circa venena et antidota reptilium austriacorum.","10.5962/bhl.title.5108"
"Robin, Ch.","31330","27179053","Du microscope et des injections : dans leurs applications à l'anatomie et à la pathologie, suivi d'une classification des sciences fondamentales, de celle de la biologie et de l'anatomie en particulier /","10.5962/bhl.title.51243"
"Buffon, Georges Louis Leclerc,","2134","36915547","Histoire naturelle, générale et particulière contenant les époques de la nature","10.5962/bhl.title.51306"
"Davis, D. Dwight","2710","75895079","The giant panda : a morphological study of evolutionary mechanisms / D. Dwight Davis.","10.5962/bhl.title.5133"
"Macquart, J,","11618","66615504","Diptères exotiques nouveaux ou peu connus, par J. Macquart ...","10.5962/bhl.title.15792"
"Quatrefages, A. de","6974","100206979","Rsum des observations faites en 1844 sur les gastropodes phlbentrs / ","10.5962/bhl.title.51508"
"Jenner, Thomas,","38068","","London's blame, if not its shame manifested by the great neglect of the fishery, which affordeth to our neighbor nation yeerly, the revenue of many millions ... or the inestimable riches of the British seas, which do yield a monthly harvest of several fish in their season ... dedicated by Thomas Jenner to the corporation of the poor, in the city of London ..","10.5962/bhl.title.51790"
"Ettingshausen, Constantin,","6580","42592854","Physiographie der Medicinal-Pflanzen : nebst einem Clavis zur Bestimmung der Pflanzen mit besonderer Berücksichtigung der Nervation der Blätter /","10.5962/bhl.title.51847"
"Sultzer, Charles.","38188","193964695","Beschreibung eines neu-entdeckten Eingeweide-Wurms im menschlichen Körper /","10.5962/bhl.title.51938"
"Darwin, Charles,","93","27063124","Journal of researches into the natural history and geology of the countries visited during the voyage round the world of H.M.S. 'Beagle,' under the command of Captain Fitz Roy /","10.5962/bhl.title.52034"
"McNair, James Birtley,","3349","37276369","Spices and condiments /  by James B. McNair, Asst. Curator of Economic Botany.","10.5962/bhl.title.5204"
"Peterson, Randolph L.","38303","93589509","A new bat of the genus Vampyressa from Guyana, South America : with a brief systematic review of the genus /","10.5962/bhl.title.52062"
"Lange, Dan. de","38552","119790601","Studien zur Entwicklungsgeschichte des japanischen Riesensalamanders (Megalobatrachus maximus Schlegel). ","10.5962/bhl.title.52375"
"Hussakof, Louis,","4727","166291094","A new pycnodont fish from the Cretaceous of Arkansas /  Louis Hussakof --","10.5962/bhl.title.5267"
"Pulst, Carl Wilhelm,","4775","309600076","Die Widerstandsfähigkeit einiger Schimmelpilze gegen Metallgifte.","10.5962/bhl.title.5387"
"McFadyean, John,","39796","92838917","The anatomy of the horse, a dissection guide.","10.5962/bhl.title.54049"
"Dean, Ruth,","39824","73120236","The livable house, its garden / ","10.5962/bhl.title.54103"
"Menger, Rudolph,","39927","16969590","Texas nature observations and reminiscences, ","10.5962/bhl.title.54304"
"Fiske, George B.","18504","71015980","Profits in poultry; useful and ornamental breeds and their profitable management.","10.5962/bhl.title.54438"
